ID,Dec
10000,مرحبا. سعيد بلقائك.
10001,بدعم من المدير} خلق فريقا جديدا في الدوري الرول.
10002,يرجى تذكر فريقك أولا.
10003,دعنا نجعل فريق AAA في التاريخ.
10004,هذا هو أول مباراة في الدوري.
10005,هنا يمكنك أن ترى معلومات فريقنا والفرق الأخرى قبل المباراة.
10006,لدى الفريق الحالي بالفعل لاعب مشترك.
10007,لكنك تحتاج إلى الكثير من اللاعبين للفوز.
10008,دعنا نحصل على لاعب جديد أولا قبل المباراة.
10009,اضغط على سوق التوظيف
10010,يمكنك تجنيد لاعبين جدد لديهم جوهر لديك في سوق التوظيف.
10011,دعونا استئجار لاعب جديد مع جوهر لدينا الآن.
10012,اضغط على زر شراء المشغلات.
10013,لدينا لاعب جديد.
10014,الفريق لا يزال غير قابل للتنافسية. دعونا استئجار لاعب أفضل لتحسين قدرتنا التنافسية لدينا.
10015,لا يوجد جوهر كاف لتجنيد لاعب جيد. في هذه الحالة} يمكنك الحصول على رقم صحيح باستخدام الراعي.
10016,عرض جميع إعلانات الفيديو الراعية} لكسب المكافآت.
10017,في البداية} إعلانات متميزة مستعدة خصيصا لاستلام مكافآت أكثر بنسبة 50٪.
10018,الصحافة الإعلان برعاية.
10019,أرسلنا رعايتا عددا صحيحا. الآن دعونا الحصول على لاعب جديد مع هذا صحيح.
10020,يرجى الضغط على زر الشراء.
10021,لدينا لاعب جديد.
10022,الآن دعونا نحاول لاعب جديد.
10023,اضغط على زر إدارة المشغل.
10024,في إدارة المشغل}، يمكنك تحديد مشغل مرشح.
10025,اضغط على زر Swap لتجربة المرشح.
10026,سيؤدي الضغط على استبدال اللاعب المحدد إلى تشغيل لاعب بدء التشغيل وسيتم ترشيح اللاعب الموجود.
10027,أيضا} اعتمادا على تكوين المبتدئين} يمكن الحصول على تأثيرات إضافية.
10028,اضغط الزر
10029,يمكنك العثور على معلومات حول تيم كيميائي هنا.
10030,يمكنك جعل فريقك أقوى من خلال مطابقة كيمياء مختلفة مثل النوع والفريق.
10031,اضغط X للخروج.
10032,الآن دعنا نغير اللاعب الذي ليس مطلوبا لاعب آخر.
10033,حاول الضغط على إعادة التركيب.
10034,هنا يمكنك استبدال أربعة مرشحين مع لاعبين جدد.
10035,مؤقتا أعطيت أربعة لاعبين. دعونا إعادة تجميع هؤلاء اللاعبين.
10036,"اضغط على الزر ""إضافة""."
10037,"اضغط على الزر ""إضافة""."
10038,"اضغط على الزر ""إضافة""."
10039,"اضغط على الزر ""إضافة""."
10040,ضع جميع اللاعبين الثلاثة. الآن دعنا نتغير إلى لاعب جديد.
10041,يمكنك التحقق من معلومات قدرة اللاعب من معلومات التوظيف.
10042,الآن الحصول على اللاعب.
10043,حاول الضغط على إعادة التركيب.
10044,بهذه الطريقة يمكنك استبدال اللاعبين الموجودين مع لاعبين جدد.
10045,الآن دعونا نلعب مع هؤلاء اللاعبين.
10046,اضغط على زر التطابق
10047,اضغط على زر تقدم اللعبة.
10048,بدأت اللعبة.
10049,دعونا نثق في اللاعبين ومشاهدة اللعبة.
10050,مثل هذا} عند انتهاء اللعبة}، يمكنك الحصول على الخبرة والأعداد الصحيحة.
10051,لا يمكن الحصول على جوهر إذا تم تجاوز حد التطابق اليومي.
10052,اضغط على زر متابعة للخروج من الملعب.
10053,انتهت اللعبة الأولى.
10054,اللاعبون مهمون للفوز} لكن استراتيجية المدير مهمة أيضا.
10055,اضغط على زر الاستراتيجية.
10056,إعداد سريع يجعل من السهل إعداد استراتيجيات رئيسية.
10057,التوازن هو الآن الاستراتيجية الأساسية.
10058,دعنا نغير الإعدادات.
10059,انقر فوق الخط / إدارة.
10060,تطابق / عملية الخط هي استراتيجية تنهي اللعبة عن طريق تشغيل المكاسب التي ينظر إليها في مباراة خط.
10061,دعنا نغير استراتيجية عملية خط الخط.
10062,اضغط على زر الإعدادات
10063,لقد تغيرت استراتيجية الفريق الآن مع خط إلى المدى.
10064,هذا الإعداد السريع يجعل من السهل تغيير استراتيجية فريقك.
10065,يمكن تعيين إعدادات مفصلة عبر التعليمات و Pickvan.
10066,الآن دعونا اختبار استراتيجيتنا.
10067,اضغط على زر التطابق
10068,دعونا نرى كيفية استخدام عناصر المباراة قبل المتابعة إلى المباراة.
10069,! اضغط الزر.
10070,سمعت عن عنصر تجربة إضافية بنسبة 10٪ كهدية.
10071,يرجى التحقق من الاستخدام.
10072,إذا قمت بفحص الاستخدام، فسوف تستخدم العنصر المقابل في المباريات المستقبلية.
10073,إذا كانت هناك عناصر متعددة، يمكنك التحقق من السيارات لاستخدام العناصر تلقائيا.
10074,لا يمكن استخدام عناصر من نفس النوع مرارا وتكرارا.
10075,اضغط X للخروج.
10076,الآن دعنا نتحقق من الاستراتيجيات والعناصر.
10077,اضغط على زر تقدم اللعبة
10078,بعد هذه المباراة، ارتفع مستوى المدير.
10079,كما يزيد مستوى المدير، تحصل على جوهر إضافي مثل هذا.
10080,يمكنك الحصول على خلاصات إضافية من مستوى المدير بغض النظر عن حد المباراة اليومية.
10081,اضغط على زر متابعة للخروج من الملعب.
10082,تم تسوية بعض اللاعبين من خلال الحصول على تجربة في هذه المباراة.
10083,اللاعبون الذين يصلون مستوى قد يزيد من إحصائياتهم.
10084,اضغط على إدارة اللاعب.
10085,الرياضيون الذين قاموا بالتساوي لديهم علامة السهم على المستوى.
10086,اضغط على مستوى اللاعب لرفع الإحصائيات.
10087,هنا يمكنك زيادة الإحصائيات المرجوة عن طريق النقاط.
10088,يمكنك زيادة القانون الإحصائي عن طريق النقر على سهم القانون الإحصائي المرغوب فيه.
10089,اضغط على الإحصائيات المرجوة الخاصة بك واتخاذ القرار.
10090,هذا سوف يزيد من قدرة اللاعب.
10091,اضغط X للخروج.
10092,يمكن أن يكون الرياضيون أقوى من خلال التسوية وتعزيز مثل هذا.
10093,دعونا نجعل اللاعب أقوى من خلال تعزيز.
10094,اضغط على زر التعزيز.
10095,التعزيز يجعل اللاعب أقوى من خلال نفس اللاعب.
10096,هذه المرة} دعونا إعادة تشغيل اللاعب الذي أعطيته لك.
10097,حاول الضغط على زر ▼.
10098,اضغط على الزر لخفض قائمة المبتدئين. اضغط على الزر لرؤية قائمة أكبر من اللاعبين الفرعين.
10099,حاول الآن إضافة لاعب.
10100,"اضغط على الزر ""إضافة""."
10101,إذا تمت إضافة لاعب} فقط نفس اللاعب مرئي.
10102,"اضغط على الزر ""إضافة""."
10103,كما يتم إضافة لاعبين الأشياء} يمكنك رؤية فرصة النجاح.
10104,يحدد احتمالية النجاح عن طريق الفرق بين مستوى التعزيز ومستوى التعزيز.
10105,اضغط على زر Reinfroce.
10106,إذا قمت بإعادة تشغيل مثل هذا} يختفي مشغل الأشياء.
10107,عدم القيام بذلك لا يجعل اللاعب الرئيسي يختفي أو يفقد الفصل.
10108,الآن دعنا آخر مرة تحقق من معلومات الدوري.
10109,اضغط على زر الدوري.
10110,اضغط على زر الجدول.
10111,يمكنك التحقق من جدول الدوري لفريقك هنا.
10112,اضغط على زر الترتيب.
10113,هنا يمكنك أن ترى ترتيب الدوري.
10114,اضغط على زر البطولة
10115,هنا يمكنك التحقق من التصفيات بعد انتهاء الدوري العادي.
10116,W هو الترتيب للتقدم إلى بطولة العالم.
10117,تقام بطولة العالم في نهاية الدوري العادي.
10118,يمكنك التنافس ضد أعلى الفرق في بطولات الدوري الأخرى واحصل على مكافآت أعلى.
10119,"اضغط على الزر ""مجموعة""."
10120,حيث تريد الدوري
10121,يمكنك ضبط مستوى الصعوبة وبدء دوري جديد.
10122,من خلال تحديد الدوري والصعوبة، يمكنك رؤية المكافآت المتغيرة وقدرة فريق الدوري.
10123,اختر مستوى الدوري وصعوبة الصعوبة واضغط على زر بدء تشغيل الدوري الجديد.
10124,يمكنك بدء دوري جديد مثل هذا.
10125,الآن كل شيء جاهز.
10126,وأخيرا} أرسلنا المدير جوهره.
10127,دعونا نجعل الفائز في الدوري AAA!
10128,مرحبا. مرحبا بك في لعبة Multi Match.
10129,هنا يمكنك لعب مباراة المدربين الآخرين.
10130,هنا يمكنك أن ترى تصنيفات فريقك} النقاط ومطابقة DATAS.
10131,اضغط على زر Reward Information.
10132,هنا يمكنك العثور على معلومات حول مكافآت المباراة متعددة.
10133,على طاولة الطبقة} هناك ستة طبق من البرونز} الفضة} الذهب} البلاتين} الماس} سيد} سيلجر.
10134,في المرة الأولى التي تبدأ فيها} تبدأ بطبقة برونزية.
10135,ترفع المستوى الخاص بك منحك الجوهر أعلاه.
10136,ويمكنك كسب جوهر مكافأة في نهاية المباراة بالنسبة المئوية المشار إليها أدناه.
10137,سوف أشرح الموسم.
10138,يعيد هذا الموسم إعادة تعيين الطبقة ويبدأ لعبة جديدة بعد فترة محددة.
10139,عندما يبدأ موسم جديد، فإنك تكافئ وفقا لرتبة الموسم الماضي.
10140,المكافآت من أجل المستوى الخاص بك يمكن العثور عليها هنا.
10141,الآن اضغط على X للخروج من معلومات المكافأة.
10142,للطبقة} عليك أن تفوز بالمباراة وجمع النقاط.
10143,جمع 100 نقطة للتقدم إلى المستوى التالي.
10144,ولكن كن حذرا لأنه يمكنك تخفيض الرحل في خسارة مستمرة عند الصفر.
10145,إذا قمت برفع المستوى الأعلى الخاص بك عن طريق الفوز}، يمكنك التحقق من تصنيف فريقك من خلال الترتيب أدناه.
10146,ويمكنك أن ترى فريق المهاحين بالتفصيل.
10147,اضغط الزر.
10148,يمكنك الآن رؤية اللاعبين والاستراتيجيات المستخدمة من قبل المراهنات. التحقق من ذلك وينمو فريقك أقوى.
10149,الآن دعونا اضغط على الزر مرة أخرى.
10150,ترتيب يستغرق وقتا للتحديث.
10151,إذا كنت ترغب في تحديث فورا}، يمكنك تحديث الترتيب على الفور عبر زر التحديث.
10152,حسن. جاهز رفع رتبتك وجمع النقاط لتصبح أفضل المدير!
10153,في حسابك} يمكنك رؤية معلومات حسابك والإنجازات اليومية}} معلومات أخرى.
10154,في يومية} يتم تحديث المهام كل يوم.
10155,في الإنجازات} يمكنك أن ترى الإنجازات
10156,في الموسم}، يمكنك رؤية المهام الجديدة التي تم تحديثها كل موسم.
10157,في أخرى}، يمكنك رؤية أجزاء أخرى مثل دعم المطور.
10158,يمكنك كسب المكافآت عن طريق إكمال إنجازات البحث أو الأجزاء الأخرى.
10159,بالإضافة إلى ذلك، ستساعدنا الرعاية في الاستمرار في تطوير اللعبة في المستقبل.
10160,أشكركم على رعايتكم. شكرا لك.
