ID,Dec
10000,Oi. Prazer em conhecê-lo.
10001,"Com o apoio do gerente}, ele criou uma nova equipe na LOL League. "
10002,Nomeie sua equipe primeiro. 
10003,Vamos transformar a equipe AAA na história. 
10004,Esta é a primeira partida da liga. 
10005,Aqui você pode ver as informações de nossa equipe e outras equipes antes da partida. 
10006,A equipe atual já tem um jogador inscrito. 
10007,Mas você precisa de muitos jogadores para vencer. 
10008,Vamos conseguir um novo jogador antes da partida. 
10009,Toque no mercado de recrutamento 
10010,Você pode recrutar novos players com a essência que você tem no mercado de recrutamento. 
10011,Vamos contratar um novo jogador com a essência que temos agora. 
10012,Pressione o botão Buy Players. 
10013,Temos um novo jogador. 
10014,A equipe ainda não é competitiva. Vamos contratar um jogador melhor para melhorar nossa competitividade. 
10015,Não há essência suficiente para recrutar um bom jogador. Nesse caso} você pode obter um número inteiro usando um patrocinador. 
10016,Veja todos os anúncios de vídeo dos patrocinadores} para ganhar recompensas. 
10017,Inicialmente} anúncios patrocinados estão especialmente preparados para receber 50% mais recompensas. 
10018,Pressione publicidade patrocinada. 
10019,O patrocinador nos enviou um número inteiro. Agora vamos conseguir um novo jogador com este número inteiro. 
10020,Pressione o botão Compra. 
10021,Temos um novo jogador. 
10022,Agora vamos tentar um novo jogador. 
10023,Pressione o botão de gerenciamento do player. 
10024,No gerenciamento do jogador} você pode selecionar um candidato. 
10025,Pressione o botão Swap para experimentar o candidato. 
10026,Pressionar substituir fará com que o jogador selecionado um jogador inicial e o jogador existente serão indicados. 
10027,"Também}, dependendo da composição dos iniciantes} efeitos adicionais podem ser obtidos. "
10028,Aperte o botão
10029,Você pode encontrar informações sobre Tim Chemie aqui. 
10030,"Você pode tornar sua equipe mais forte combinando diferentes químicas, como tipo e equipe. "
10031,Pressione x para sair. 
10032,Agora vamos mudar o jogador que não é necessário para outro jogador. 
10033,Tente pressionar a recombinação. 
10034,Aqui você pode substituir quatro candidatos por novos jogadores. 
10035,Temporariamente dei quatro jogadores. Vamos recombinar esses jogadores. 
10036,Pressione o botão Adicionar. 
10037,Pressione o botão Adicionar. 
10038,Pressione o botão Adicionar. 
10039,Pressione o botão Adicionar. 
10040,Coloque os três jogadores. Agora vamos mudar para um novo jogador. 
10041,Você pode verificar as informações de habilidade do jogador das informações de recrutamento. 
10042,Agora pegue o jogador. 
10043,Tente pressionar a recombinação. 
10044,"Dessa forma, você pode substituir os jogadores existentes por novos jogadores. "
10045,Agora vamos jogar com esses jogadores. 
10046,Pressione o botão de correspondência 
10047,Pressione o botão Progresso do jogo. 
10048,O jogo começou. 
10049,Vamos confiar nos jogadores e assistir ao jogo. 
10050,Assim} quando o jogo acabar} você pode obter experiência e números inteiros. 
10051,A essência não pode ser obtida se o limite diário de correspondência for excedido. 
10052,Pressione o botão Continuar para sair do estádio. 
10053,O primeiro jogo acabou. 
10054,"Os jogadores são importantes para ganhar}, mas a estratégia do gerente também é importante. "
10055,Pressione o botão da estratégia. 
10056,A configuração rápida facilita a configuração de estratégias -chave. 
10057,O equilíbrio é agora a estratégia básica. 
10058,Vamos alterar as configurações. 
10059,Clique na linha / gerenciamento. 
10060,A correspondência / operação da linha é uma estratégia que termina o jogo operando os ganhos vistos na correspondência da linha. 
10061,Vamos mudar a estratégia para a operação da linha de linha. 
10062,Pressione o botão Configurações 
10063,A estratégia da equipe agora mudou com a linha a punção. 
10064,Essa configuração rápida facilita a mudança da estratégia da sua equipe. 
10065,Configurações detalhadas podem ser definidas através das instruções e da pickvan. 
10066,Agora vamos testar nossa estratégia. 
10067,Pressione o botão de correspondência 
10068,Vamos ver como usar os itens correspondentes antes de prosseguir para a partida. 
10069,! Aperte o botão.
10070,Ouvi um item de experiência adicional de 10% como presente. 
10071,Verifique o uso. 
10072,"Se você verificar o uso, usará o item correspondente em correspondências futuras. "
10073,"Se houver vários itens, você poderá verificar automaticamente os itens. "
10074,Os itens do mesmo tipo não podem ser usados repetidamente. 
10075,Pressione x para sair. 
10076,Agora vamos conferir as estratégias e itens. 
10077,Pressione o botão Progresso do jogo 
10078,"Após esta partida, o nível do gerente aumentou. "
10079,"À medida que o nível do gerente aumenta, você obtém uma essência extra como esta. "
10080,"Você pode obter essências extras do nível do gerente, independentemente do limite diário de correspondência. "
10081,Pressione o botão Continuar para sair do estádio. 
10082,Alguns jogadores foram nivelados ganhando experiência nesta partida. 
10083,Os jogadores que subiram de nível podem aumentar suas estatísticas. 
10084,Pressione o gerenciamento do player. 
10085,Os atletas que se levantaram têm uma marca de seta no nível. 
10086,Toque no nível do jogador para aumentar as estatísticas. 
10087,Aqui você pode aumentar as estatísticas desejadas por pontos. 
10088,Você pode aumentar a estatística tocando a seta da estatística desejada. 
10089,Toque nas estatísticas desejadas e toque na decisão. 
10090,Isso aumentará a capacidade do jogador. 
10091,Pressione x para sair. 
10092,Os atletas podem ser mais fortes ao nivelar e fortalecer assim. 
10093,Vamos tornar o jogador mais forte por reforçar. 
10094,Pressione o botão reforçar. 
10095,O reforço torna o jogador mais forte através do mesmo jogador. 
10096,Desta vez} vamos reinfrocrar o jogador que dei a você. 
10097,Tente pressionar o botão ▼. 
10098,Pressione o botão para dobrar a lista de iniciantes. Pressione o botão para ver uma lista maior dos sub players. 
10099,Agora tente adicionar um jogador. 
10100,Pressione o botão Adicionar. 
10101,Se um jogador for adicionado} apenas o mesmo jogador estiver visível. 
10102,Pressione o botão Adicionar. 
10103,"Como os jogadores são adicionados}, você pode ver a chance de sucesso. "
10104,A probabilidade de sucesso é determinada pela diferença entre o nível de reforço e o nível de reforço. 
10105,Pressione o botão Reinfroce. 
10106,"Se você reinfrocou como este}, o jogador do material desaparece. "
10107,Não fazer isso não faz o jogador principal desaparecer ou perder a classe. 
10108,Agora vamos verificar as informações da liga. 
10109,Pressione o botão da liga. 
10110,Pressione o botão Agenda. 
10111,Você pode verificar a programação da liga para sua equipe aqui. 
10112,Pressione o botão de classificação. 
10113,Aqui você pode ver a classificação da liga. 
10114,Pressione o botão do torneio 
10115,Aqui você pode verificar os playoffs após o término da liga regular. 
10116,W é o ranking para avançar para o campeonato mundial. 
10117,O Campeonato Mundial é realizado no final da liga regular. 
10118,Você pode competir contra as principais equipes de outras ligas e obter recompensas mais altas. 
10119,Pressione o botão Definir. 
10120,Onde você deseja a liga 
10121,Você pode definir o nível de dificuldade e iniciar uma nova liga. 
10122,"Ao selecionar uma liga e dificuldade, você pode ver as recompensas alteradas e a capacidade do time da liga. "
10123,Escolha sua liga e nível de dificuldade e pressione o botão Start New League. 
10124,Você pode iniciar uma nova liga como esta. 
10125,Agora tudo está pronto. 
10126,Finalmente} o gerente nos enviou a essência. 
10127,Vamos fazer o vencedor da liga AAA! 
10128,Oi. Bem -vindo ao jogo de partida multi. 
10129,Aqui você pode jogar a partida de outros treinadores. 
10130,Aqui você pode ver as classificações da sua equipe} pontos e corresponder a dados. 
10131,Pressione o botão Informações da recompensa. 
10132,Aqui você pode encontrar informações sobre as recompensas da correspondência multi. 
10133,"Na tabela de nível}, existem seis camadas de bronze} prata} ouro} platinum} diamante} mestre} Celinger. "
10134,A primeira vez que você inicia} você começa com uma camada de bronze. 
10135,Aumentar sua camada lhe dará a essência acima. 
10136,E você pode ganhar essência de bônus no final da partida pela porcentagem indicada abaixo. 
10137,Vou explicar a estação. 
10138,A temporada redefine o nível e inicia um novo jogo após um período fixo. 
10139,"Quando uma nova temporada começa, você é recompensado de acordo com a classificação da última temporada. "
10140,As recompensas para sua camada podem ser encontradas aqui. 
10141,Agora pressione x para sair das informações de recompensa. 
10142,Para cima} você precisa ganhar a partida e coletar pontos. 
10143,Colete 100 pontos para avançar para o próximo nível. 
10144,Mas tenha cuidado porque você pode ser rebaixado por uma perda contínua em zero. 
10145,"Se você aumentar sua camada mais alto ao ganhar}, poderá verificar a classificação da sua equipe na classificação abaixo. "
10146,E você pode ver a equipe de Rankers em detalhes. 
10147,Aperte o botão.
10148,Agora você pode ver os jogadores e estratégias usados pelos Rankers. Confira e aumente sua equipe mais forte. 
10149,Agora vamos pressionar o botão novamente. 
10150,A classificação leva tempo para atualizar. 
10151,"Se você deseja atualizar imediatamente}, pode atualizar a classificação imediatamente através do botão Atualizar. "
10152,Bom. Ready Levante sua classificação e colete pontos para se tornar o principal gerente! 
10153,Em sua conta} você pode ver as informações da sua conta e as conquistas diárias}} outras informações. 
10154,No Daily} missões são atualizadas todos os dias. 
10155,Nas realizações} você pode ver as conquistas 
10156,Na temporada} você pode ver as novas missões atualizadas a cada estação. 
10157,"Em outros} você pode ver outras partes, como suporte ao desenvolvedor. "
10158,Você pode ganhar recompensas concluindo as realizações da missão ou outras partes. 
10159,"Além disso, o patrocínio nos ajudará a continuar a desenvolver o jogo no futuro. "
10160,Obrigado pelo seu patrocínio. Obrigado.
